name,rating,description,num_reviews,website,phone,email,address,city,state,latitude,longitude
SafeTravel,,A People Person Our mission is to provide safe quality transportation to our valued clients and to ensure the most pleasant experience to their destinations.,0,http://safetravelllc1.one,,,"Atlanta, GA",Atlanta,GA,,
3Quest Challenge of Atlanta,,"Looking for things to do in Atlanta? We can help you see the city in a different way with our 3Quest Challenge scavenger hunts. Using your smartphone, you'll be given a list of challenges to complete and items to find on our scavenger hunt app. You'll have a remote ""Host"" that will help you along the way. Your goal is to find all the items in Atlanta to beat the game.",0,https://www.3questchallenge.com,+1 843-212-6458,customerservice@3questchallenge.com,"235 Andrew Young International Blvd NW, Atlanta, GA 30303-2718",Atlanta,GA,,
Crazy Dash of Atlanta,,"Looking for things to do in Atlanta? We can help you see the city in a different way with our Crazy Dash city scavenger hunts. Using your smartphone, you'll be given a list of challenges to complete and items to find on our scavenger hunt app. You'll have a remote ""Host"" that will help you along the way. Your goal is to find all the items in Atlanta to beat the game.",0,https://www.crazydash.com,+1 843-256-6747,customerservice@crazydash.com,"235 Andrew Young International Blvd NW Suite L2, Atlanta, GA 30303",Atlanta,GA,33.75962,-84.39437
The Spa At The Whitley,,"The Spa at The Whitley, where you’ll find total rejuvenation of the mind, body, and soul amidst the hustle and bustle of one of Atlanta’s most exclusive districts. Our serene, timeless setting offers all of the warm hospitality of the South with a full range of sophisticated salon and spa treatments for hotel guests and locals alike. Our newly renovated spa features a lounge, boutique shop, treatment rooms, Himalayan salt room, and more. In addition to our signature treatments and therapies, we offer a rotating menu of limited-time, seasonal services. These ever-changing, ever-inviting treatments reflect timely themes and make the most of seasonal ingredients.",0,https://www.marriott.com/hotels/hotel-information/fitness-spa-services/atllu-the-whitley-a-luxury-collection-hotel-atlanta-buckhead/?scid=bb1a189a-fec3-4d19-a255-54ba596febe2#,+1 404-237-2700,spa@whitleyhotel.com,"3434 Peachtree Rd NE, Atlanta, GA 30326-1172",Atlanta,GA,33.850468,-84.36315
Afro Nightspots,,We provide Nightlife tours in Metro Atlanta. Our tour consist of a VIP experiences at the hottest clubs and lounges in Atlanta.,0,http://afronightspots.com,+1 404-594-2376,info@afronightspots.com,"2663 Pinto Dr, Atlanta, GA 30096-6040",Atlanta,GA,33.95255,-84.18598
Operation City Quest Scavenger Hunt of Atlanta,,"Looking for things to do in Atlanta? We can help you see the city in a different way with our city scavenger hunts. Using your smartphone, you'll be given a list of challenges to complete and riddles to solve on our scavenger hunt app. You'll have a remote ""Host"" that will help you along the way. Your goal is to find all the items in Atlanta to beat the game.",0,https://www.operationcityquest.com,+1 843-212-6609,customerservice@operationcityquest.com,"235 Andrew Young International Blvd NW, Atlanta, GA 30303-2718",Atlanta,GA,33.75962,-84.39437
Wacky Walks of Atlanta,,"Looking for things to do in Atlanta? We can help you see the city in a different way with our Wacky Walks city scavenger hunts. Using your smartphone, you'll be given a list of challenges to complete and items to find on our scavenger hunt app. You'll have a remote ""Host"" that will help you along the way. Your goal is to find all the items in Atlanta to beat the game.",0,https://www.wackywalks.com,+1 843-695-7342,customerservice@wackywalks.com,"235 Andrew Young International Blvd NW, Atlanta, GA 30303",Atlanta,GA,33.75962,-84.39437
Rolling Hills Horse Ranch,,"We are a family owned horse ranch and mini farm located in southwest Atlanta GA. We sit on 90 acres of land and are home to horses, cows, sheep, and chickens. Our property is a true sanctuary conveniently located just 15 minutes from downtown. ",0,http://rollinghillshorseranch.com,+1 678-421-4591,therollinghillshorseranch@gmail.com,"3502 Enon Rd, Atlanta, GA 30349-1236",Atlanta,GA,33.65998,-84.58756
Aw Pottery Atlanta,,,0,http://www.Awpotteryatl.com,+1 770-220-2900,,"3200 Cumberland Dr, Atlanta, GA 30341-3065",Atlanta,GA,33.88581,-84.291794
Ambassador Global Chauffeur,,,0,http://www.atlanta-limos.com/,+1 404-621-2544,atlsedanservice@gmail.com,"3355 Lenox Rd NE Suite 750, Atlanta, GA 30326-1394",Atlanta,GA,33.8467,-84.35799
IPIC Atlanta,,"IPIC Atlanta is a nine-screen, 426-seat luxury theater now open at the reimagined Colony Square. A pioneer of the dine-in theater concept, IPIC® Theaters' mission is to a create an unforgettable experience for guests. IPIC’s ultimate experience for the senses includes the latest Hollywood blockbusters and specially curated films, chef-inspired cuisine, craft cocktails and exceptional service. Guests can enjoy elevated food and beverage service delivered seat-side by 'ninja-like' servers for a true dine-in-the-dark experience, while relaxing in luxe reclining leather Pod seats.",0,http://www.ipic.com/atlanta_colony_square,+1 470-893-8525,,"1197 Peachtree St NE, Suite350, Atlanta, GA 30361-3502",Atlanta,GA,33.78757,-84.38224
WOW Party Bus,,"Let WOW Party Bus transport you to Atlanta's hottest attractions. You will enjoy your introduction to the sites and sounds that have transformed Atlanta into a culture that is like no other. Get an up-close look at civil rights monuments, like the Martin Luther Jr. National Historic Site. As the premier party bus company in the Atlanta area, we provide transportation options to fit any occasion. ",0,http://www.wowpartybus.com,+1 470-351-8299,info@wowpartybus.com,"390 17th St NW, Atlanta, GA 30363-2000",Atlanta,GA,33.79031,-84.39955
Talixo - Atlanta,,"Talixo is a ground transportation tech company based in Berlin and offering 4 standardized booking categories, from taxi to first class, in 100+ countries.",0,http://www.talixo.com,+49 30 346497360,support@talixo.com,"Danckelmannstr. 9, Atlanta, GA 14059",Atlanta,GA,,
Victorino Omar Rasmussen,,"Hi I'm Victorino! I fly a classic biplane and have a passion for sharing the bucket-list experience with others. I have a storied background in aviation ranging from Air Traffic Control, flight attending, bush flying, and general aviation operations. I offer sightseeing tours over the city of Atlanta, departing regularly from Dekalb-Peachtree Airport, in the metro Atlanta area. Available tour options are a 20-minute ride to Stone Mountain, or Midtown, or a combination of the two for 40 minutes.",0,http://www.atlantabiplane.com,,,"Atlanta, GA",Atlanta,GA,,
MY TRANSFER GROUP,,We are a company specialized in the transfers industry with a very solid infrastructure developed especially to satisfy the needs of passengers and distribution channels such as Travel Agencies and Airlines. Our idea is based on being able to integrate into a single platform and a single process the needs of travelers and the offer of transportation services from local suppliers around the world.,0,http://www.mytransfergroup.com,+57 316 3075478,info@mytransfergroup.com,"cll 118 # 19-09 Of 503, Atlanta, GA 110131",Atlanta,GA,,
T. L. Dowell's Sew/craft 4 U Atl,,,0,http://www.tldowells.com,+1 470-231-5472,,"3070 Presidential Pkwy Suite 152, Atlanta, GA 30340-3712",Atlanta,GA,33.87903,-84.27145
Taxi2Airport Atlanta,,"Taxi2Airport.com is an online reservation and booking system for airport transfers all around the globe. We are committed to providing safe and reliable transfers over all areas to and from all airports, cruise ports, and main train stations. Our service operates across 150+ countries and 1500+ airports with an excellent customer satisfaction rating of 4.5 out of 5 based on 35k+ reviews.",0,https://www.taxi2airport.com,+31 88 318 8344,support@taxi2airport.com,"Weteringschans 28, Atlanta, GA 1017 SG",Atlanta,GA,34.86223,-83.50739
Booth Muse,,"Booth Muse is the FIRST Selfie Booth Museum and is conveniently located in Atlanta, Ga. The go-to spot for selfie takin and photo boothin to max out all of your phone’s storage. With our one of a kind and always changing trendy set designs, you can now take even more incredible selfie photos of yourself, with your family, co-workers, or whole squad all under one roof.",0,http://boothmuse.com,+1 470-588-7753,info@boothmuse.com,"2960 Olympic Industrial Dr SE, Atlanta, GA 30339-1908",Atlanta,GA,33.83433,-84.46968
Pickup And Drop Transportation & Limousines,,"Pickup And Drop Transportation is a luxury limousine and black-car transport service in Atlanta GA. We provide travelers with safe chauffeured driven transportation to and from Atlanta airports. We have the latest Sedans, SUV's & Buses to meet all of your ground transportation needs. Check out our business class rates on our website. Our motto is: ""The Best Travel Decision You'll Ever Make"" ©",0,https://pickupanddrop.com,+1 404-761-4139,admin@pickupanddrop.com,"1561 Virginia Ave Suite 211A, Atlanta, GA 30337-2863",Atlanta,GA,33.65931,-84.44027
Try find your better than us ! SmartRyde Atlanta,,"Enjoy traveling to your destination in a comfortable car ! We are SmartRyde of airport transfer service provider in Japan, and cover more than 150 countries and 700 cities. Not only airport transfer but also charter service and sightseeing taxi. Please free to contact us if you have any questions.(24/7) https://cs-chat-global.com/ Have a nice trip ! Arigatougozaimasu SmartRyde Team",0,https://smart-ryde.com/,+855 71 402 5302,Customer@dlgbinc.com,"Higashishinbashi 2-10-10 Higashishinbashi Bldg 502, Atlanta, GA 105-0021",Atlanta,GA,,
Steady Hand Beer Co.,,"Steady Hand Beer Co. founded in 2017 brings culinary-driven brews to Atlanta and provides a vibrant, comfortable space for all to enjoy! The brewery’s Westside Taproom offers a spacious, dog-friendly environment which is consistently filled with local live music acts, food trucks, chef pop-ups and of course locals from the neighborhood. ",0,http://www.steadyhandbeer.com/,+1 404-458-5981,events@steadyhandbeer.com,"1611 Ellsworth Industrial Blvd NW Ste F, Atlanta, GA 30318-3732",Atlanta,GA,,
Atlanta Selfie Museum,,"Looking for places to go in Downtown Atlanta? Here at the Atlanta Selfie Museum we take pictures to a whole new level of awesomeness! To all our photo lovers and enthusiasts for pop-up Museums in Atlanta, you don’t want to miss out on the Atlanta Selfie Museum! Cheers to you and yourselfie!",0,http://atlantaselfie.com,+1 404-566-5778,atlantaselfiemuseum@gmail.com,"116 Centennial Olympic Park Dr SW, Atlanta, GA 30313-2405",Atlanta,GA,33.751736,-84.39925
Casey Corporate Transportation,,"Casey Corporate Transportation is an elite provider of professional, reliable, luxury transportation services worldwide, whose mission is to make a difference one person at a time by making life easier, creating peace of mind and generating unforgettable experiences.",0,https://www.cctatlanta.com/,+1 404-688-5720,reservations@cctatlanta.com,"3401 Norman Berry Dr, Atlanta, GA 30344-5121",Atlanta,GA,33.66314,-84.42844
Outkast Mural,,,0,,,,"453 Moreland Ave NE, Atlanta, GA 30307-1562",Atlanta,GA,33.766705,-84.34888
Alexis Mccully,,"Hop’NGo Tours is a family-friendly hop-on / hop-off sightseeing tour,
thoughtfully designed to bridge old school landmarks with new school
hotspots.HNG Tours seeks to fulfill the travelers’ desires by providing the full
“Atlanta experience”, which will include plenty of cultures, murals,
entertainment, social media obsessions, and diverse restaurants. All tours are
carefully crafted to fit every type of traveler.",0,https://hopngotours.com/,,,"Atlanta, GA",Atlanta,GA,,
Feet Retreat Spa Massage,,"Feet Retreat Spa Massage is an Asian massage spa designed to help you reduce stress, relieve build up chronic pain, and increase the overall quality of your life! We specialize in multiple affordable, customized treatments to meet the needs of a wide variety of clients in a peaceful setting! We are proud to be providing Authentic Asian Massage therapy services in our beloved community of Atlanta, GA! Our Professional Asian Staff are perfect To help you relax after a long stressful day of work! Here at Feet Retreat Spa Massage we are Providing a Modern Asian Atmosphere that will make your every visit highly satisfying and give you a new rejuvenated self! Come in and visit today, you can call us now to Create your appointment, or feel free to walk in!",0,http://feet-retreat-spa-massage.business.site,+1 678-799-9198,,"857 Collier Rd NW, Atlanta, GA 30318-2532",Atlanta,GA,33.810333,-84.41599
Quicktransfer - Atlanta,,"As QuickTransfer we have been passionately realizing services for the travel industry since 2009. We are dedicated professionals providing high-class transport services on all continents. Extensive international experience makes us a trustworthy choice for everyone in need of reliable, safe and punctual transfer service.",0,http://www.quicktransfer.com,+44 20 3129 7145,booking@quicktransfer.com,"86-90 Paul Street, Atlanta, GA 24",Atlanta,GA,33.36666,-84.785736
Cherry Massage,,"Cherry Massage, is an asian massage spa designed to help you reduce stress, relieve build up chronic pain, and increase the overall quality of your life! We specialize in multiple affordable, customized treatments to meet the needs of a wide variety of clients in a peaceful setting! We are proud to be providing Authentic Asian Massage therapy services in our beloved community of Atlanta, GA! Our Professional Asian Staff are perfect To help you relax after a long stressful day of work! Here at Cherry Massage we are Providing a Modern Asian Atmosphere that will make your every visit highly satisfying and give you a new rejuvenated self! Come in and visit today, you can call us now to Create your appointment, or feel free to walk in!",0,http://cherrymassage-massagespa.business.site,+1 678-389-6658,,"4186 Buford Hwy NE Suite J, Atlanta, GA 30345-1067",Atlanta,GA,33.769806,-84.41458
Little Nancy Creek Park,,,0,,,,"4012 Peachtree Dunwoody Rd NE, Atlanta, GA 30342-3937",Atlanta,GA,33.8645,-84.35895
Atlanta Airport Transfers,,"Book Taxi Group provide private transfer services to individuals and groups in Atlanta, with a large fleet of cars and minivans",0,https://www.bookairporttransfers.com,+34 935 47 85 21,team@booktaxigroup.com,"Avda 11 de Setembre, 111 Sabadell, Atlanta, GA 08280",Atlanta,GA,33.76275,-84.38714
Travel Curious - Atlanta,,"We are Travel Curious, an international team of history buffs, travel junkies, and tech geeks who believe in a better way to travel.",0,https://travelcurious.com/united-states/atlanta/,+1 212-710-1322,reservations@travelcurious.com,"Unit C, 81 Curtain Road Shoreditch, Atlanta, GA EC2A 3AG",Atlanta,GA,,
Eatwith Atlanta,,"EatWith is the world’s leading community for authentic food experiences with locals, in 130+ countries. Through dinner parties, supper clubs, cooking classes, and food tours in private homes and special venues, EatWith connects hand-selected local hosts with travelers seeking unique, immersive food experiences.",0,https://www.eatwith.com/search?date=2020-03-15&pid=NT_fw7oye40be288veJdXfo8D&q=Atlanta%2C+GA%2C+United+States,+1 844-880-5316,support@eatwith.com,"Acre House 1/15 William Road, Atlanta, GA NW1 3ER",Atlanta,GA,33.8857,-84.25365
Jason Lopez,,"I grew up in a family of musicians. Everyone plays an instrument My DJ controller has been a part of all of my greatest experiences. I started playing on the street when I was in high school and continued through all this years.. Atlanta has become my home for the last 7 years. Working on the street everyday, I have learned a great deal about the city's history, culture, music, and landscape. I love talking to tourists and exchanging stories.",0,,,,"Atlanta, GA",Atlanta,GA,,
Push exotic rentals and tours,,Push exotic rentals is an Atlanta based company that rents out the most beautiful exotic cars ! We also do exotic car tours that showcase our beautiful city ! Discover Atlanta behind the wheel of an exotic car . No deposit necessary. You can choose to take the tour as a driver or passenger. Plenty of photo opportunities and the whole tour will be video taped! So you’ll never forget the experience.,0,http://pushrentals.com,+1 470-893-2837,pusheliteluxury@gmail.com,"3393 Peachtree Rd NE, Atlanta, GA 30326-1162",Atlanta,GA,33.84666,-84.36252
Georgia Tech Campus Recreation Center,,,0,http://www.crc.gatech.edu/home,+1 404-385-7529,,"750 Ferst Drive, Atlanta, GA 30318",Atlanta,GA,,
The Pet Set,,,0,http://thepetset.com,+1 404-633-8755,thepetset@thepetset.com,"2480 Briarcliff Rd NE, Atlanta, GA 30329-3034",Atlanta,GA,33.82698,-84.3335
Kaniak Expeditions,,"I believe saltwater fly fishing powers modern-day exploration. Through on-foot, catch & release sight fishing, I strive to connect adventurous anglers with wild ecosystems. ",0,https://kaniakexpeditions.com/,,,"Atlanta, GA",Atlanta,GA,,
PARADISE TRAVEL,,"Paradise Travel is a part of Action Tour Guide, which specializes is self-guided audio tours. The app-based tours work as a tour guide, audio guide, and map — all in one! Check out Action Tour Guide’s walking and driving tours all around the US and beyond at ActionTourGuide.com.",0,https://www.sfparadisetravel.com/,+1 508-535-8251,paradisetravel006@gmail.com,"11-b, Lohtse Chs Ltd, Ruia Park, Atlanta, GA 400049",Atlanta,GA,,
Seas the Day Travel and Tour,,"Hi, I'm Ken your Charter bus driver with a passion for travel and discovery. I am a Tour Guide and Travel Agent based in the beautiful city of Atlanta, GA. I invite you to hop on my little tour bus or van so that I can show you around my city and state. If you like to take photos that's a bonus because I am also a professional photographer (meaning I've made money not only selling photos but also teach others how to properly frame and shoot your next masterpiece. ",0,http://www.stdtourbus.com,,,"2182 Logan Dr, Atlanta, GA 30236-7202",Atlanta,GA,33.54525,-84.31949
Virtual Run Events  powered by Moon Joggers,,"We created Virtual Run Events in April 2015 because we LOVE running! And even more, we LOVE connecting with runners. Shortly after we created Moon Joggers, we began to realize that we could encourage people to get out and get moving, AND make a difference throughout the world by creating fun and unique events to raise money for various charities and causes. ",0,https://www.virtualrunevents.com/,,,"Atlanta, GA",Atlanta,GA,,
Team Building with Taste,,,0,https://www.teambuildingwithtaste.com/atlanta-cooking-classes/,+1 678-915-2815,,"6035 Peachtree Rd Suite A202, Atlanta, GA 30360-3230",Atlanta,GA,33.908257,-84.28786
kapital transportation llc,,"We offer Customized Driving and Local city Tours. Count on us to guarantee your comfort and convenience and most of all ""Safety First"". We have provided this transportation service for our guest since 1999 under the name Klassic Transportation, INC. The year 2006 we changed to a LLC.(Kapital Transportation, LLC). This let's you know Jan 2019 we celebrated 20 years of 
 service to Atlanta..",0,http://www.kapitaltransportation.com,+1 404-245-1598,kapitaltransport@bellsouth.net,"1760 Northside Dr NW 333, Atlanta, GA 30318-2665",Atlanta,GA,33.80389,-84.40918
ML Black Cars,,ML Black Cars is a Ground transportation provider offering private car services through several major cities of the united states,0,http://www.mlblackcars.com,+1 732-284-3884,concierge@mlblackcars.com,"9824 Southall Road, Atlanta, GA 21133",Atlanta,GA,,
Make a Film in a Day,,"God, Family, Life and Film A lifelong passion for movies and film drive me to want to share the process of how to work through the creative process to make a 2 to 5 minute short, with other film professionals. I am part of a screen writers group and have myself produced a couple of shorts using this method. We are in ""Gallywood"" which is now Georgia as a major US film capital. We use 'resource filming' to take what we have to create a short/micro budget film in one day.",0,http://www.makeafilminaday.com,,,"Atlanta, GA",Atlanta,GA,,
Joey Wallace Photography,,"Atlanta renewed wedding and portrait photographers and videographers documenting life special moments. Professional wedding photography and videography services in the Atlanta, Georgia area. Capturing the life of the city for its visitors and residents alike.",0,https://joeywallacephotography.com,,,"Atlanta, GA",Atlanta,GA,,
Mears Atlanta Chauffeured Services,,"Mears Global is the perfect resource for your transportation, specializing in airport transfers and all of your transportation needs.",0,https://www.mearstransportation.com/,+1 866-435-5686,kpitcherello@mears.com,"324 W Gore St, Atlanta, GA 32806-1037",Atlanta,GA,,
Atlanta Christkindl Market,,,0,http://christkindlmarket.org,,info@christkindlmarket.org,"Centennial Olympic Park, Atlanta, GA",Atlanta,GA,33.76346,-84.39201
Spalding Nix Fine Art,,"Established in 2003, Spalding Nix Fine Art is among the Southeast's leading art galleries featuring salon shows of contemporary art & a selection of Modern & Old Master paintings. As an Accredited Member of the American Society of Appraisers, Mr. Nix provides valuation services for donation, estate, insurance, & litigation-related purposes. As an art adviser, Mr. Nix assists clients in navigating",0,http://spaldingnixfineart.com/,+1 404-841-7777,info@spaldingnixfineart.com,"425 Peachtree Hills Ave NE Suite 30-A, Atlanta, GA 30305-4556",Atlanta,GA,33.817318,-84.37349
"EUROPE SHUTTLE Atlanta, Georgia",,"EUROPE SHUTTLE offers features to fit in with every need and every budget. If you are travelling for Business or pleasure, EUROPE SHUTTLE can provide you with the transportation you need. Comfortable & secure door to door service, you select where you wish to be collected from and your destination. We have a wide range of vehicles from basic to luxury cars, from Sedans to Buses up to 55 passengers",0,http://www.europeshuttle.com,+44 20 3318 1696,booking@europeshuttle.com,"Masti Tn 3-9, Atlanta, GA 11911",Atlanta,GA,34.00635,-84.35126
Jennifer Balcos Gallery,,,0,http://Jenniferbalcosgallery.com,+1 404-441-5745,Jenniferbalcosgallery@gmail.com,"11808 E Sprague ave West Side Provision District, Atlanta, GA 30305",Atlanta,GA,33.82133,-84.38332
Maune Contemporary,,"Maune Contemporary was founded by husband and wife team Heidi and Ramsey Maune out of their love for contemporary and modern art. The gallery specializes in limited edition fine art prints and originals by renowned international artists. The 2600 square foot sleek and modern gallery is located at 747-A Miami Circle NE, Atlanta, GA 30324. For more information, you can acces",0,http://www.maune.com,+1 678-705-4735,info@maune.com,"747 Miami Cir NE A, Atlanta, GA 30324-3025",Atlanta,GA,33.83042,-84.3624
Chosen Concierge,,"We provide city tours in and around Atlanta in luxury Cars, SUVs, and Sprinters. Let us show you the history of Atlanta or the New Restaurants, Clubs, and Bars",0,http://www.chosenconcierge.com,+1 678-250-3834,chosenconciergeatl@gmail.com,"Peters St, Atlanta, GA 30303",Atlanta,GA,33.75668,-84.3883
Peachy Keen Tourism Travel Unlimited,,"I have worked in the hospitality industry all my life, I must say that this has been a great ride. I began my life as a federal employee,developing and assisting with the building of African American sites in the USA. I never imagine that someone would actually pay me to talk, I can actually talk five hours, non stop. A few weeks ago, one of my clients asked me, how many hours can you carry on a conversation? I replied and told him as long as it takes. My tours are centered around history. ",0,http://www.peachykeentourism.com,,,"Atlanta, GA",Atlanta,GA,,
Iwin Foot Massage,,"iwin Foot Massage , is a new Massage spa under new management that is dedicated and designed to help you reduce stress, relieve chronic pain, and increase the quality of your life! Come in and visit today.",0,https://www.facebook.com/iwinfootmassage/,+1 678-670-2357,iwinfootmassageatl@gmail.com,"2566 Shallowford Rd NE Suite #108, Atlanta, GA 30345-1249",Atlanta,GA,33.86218,-84.28687
Tresha's Endless Travel,,"Atlanta based travel agent , I'm an Expert in Destination Honeymoons, Cruises, Vacations and River Cruises. I want to help others create their own low-stress adventure of planning amazing travel experiences! I take the time to get to know you and ensure your travel needs are met and the right package is selected with you in mind! 
",0,http://treshasendlesstravel.com,+1 888-534-0268,treshasenslesstravel@consultant.com,"1957 Myrtle Dr SW, Atlanta, GA 30311-4939",Atlanta,GA,33.70152,-84.45543
BiteLines,,"Let’s eat our way down the Atlanta BeltLine, one of Atlanta's hottest destinations. With two food halls and an explosion of new restaurants, a walk down the BeltLine is a food lover’s dream. On this insider's tour, sample cuisine from the city's hottest chefs, see up close the South's largest outdoor art gallery, and immerse yourself in Atlanta’s hippest neighborhoods.",0,http://bitelinesatl.com,+1 678-488-3173,contact@bitelinesatl.com,"Atlanta, GA",Atlanta,GA,,
M-CheapFlights,,"MCheapFlights is the leading and top notch travel agency, providing a range of choice for world wide destinations, flight tickets, airline and hotel reservations. Travel Around the World for Cheap with McheapFlights. Get airline ticket reservation with MCheapFlights at affordable prices. We have special contracted price from more than 400 domestic and International airline companies.",0,https://www.mcheapflights.com/,+1 877-211-6377,support@mcheapflights.com,"3600 Graham Way SW, Atlanta, GA 30047-3230",Atlanta,GA,33.86445,-84.08626
